,Unum Solum,https://unum-solum.com/,UnumSolum.png,"Unum Solum's approach combines physical and digital product ownership certification through digital product passports, ensuring every item not only has a distinct aesthetic but also contributes to a Circular Economy. 
They are the first phygital design agency to pioneer the application of NFTs for digital product passports, and offer a turnkey product customization through surface and visual patterns (2D/3D) and web3 to web2 digital product passport bridge. ",,R8 Recycle,R1 Rethink,No,No,No,No,Yes,No
,Used and Loved,https://usedandloved.com/,UsedAndLoved.svg,Everything second hand in one place,Fashion & Textiles,R3 Reuse,R2 Reduce,No,No,No,Yes,No,No
,VALIS,https://www.valisinsights.com/,Valis.png,"Building AI-powered software that makes recycling more profitable, material supply chains more sustainable and closes the loop on a circular economy for metal fabrication. VALIS aims to reduce waste and promote a circular economy by fully integrating and optimizing scrap metal recycling across the value chain",,R8 Recycle,,No,No,No,No,No,No
,Vestiaire Collective,https://www.vestiairecollective.com/,VestiaireCollective.svg,Secondhand luxury resale platform,Fashion & Textiles,R3 Reuse,,Yes,No,No,Yes,No,No
,Whering,https://whering.co.uk/,Whering.svg,"An app to help people discover, rediscover or refine their personal style to avoid chasing trends; reducing consumption in the process. It harnesses the power of tech to help you discover your best-dressed self, without buying any new clothes.",Fashion & Textiles,R0 Refuse,,No,No,No,No,No,No
,Winnow Solutions,https://www.winnowsolutions.com,Winnow.svg,"Winnow Solutions develops software for commercial kitchens to monitor and reduce food waste. Their platform uses AI technology to analyze food waste data and provide insights to chefs and kitchen staff, helping them minimize waste and cut costs.",Retail,R2 Reduce,R8 Recycle,No,No,No,No,No,No
,Refurbed,http://www.refurbed.com,Refurbed.svg,"A platform for refurbished products that meet an ambitious set of criteria with regards to safety, quality and their warranty. This empowers consumers to conduct their purchases in an easier, risk-free and sustainable manner.",IT Hardware,R3 Reuse,,Yes,No,No,No,No,No
,Circuland,https://circuland.co.uk/,Circuland.png,"We provide a one-stop shop for Digital Materials Passports in the Built Environment, unlocking the hidden potential of your materials and projects. Our platform simplifies and streamlines the process to enable reuse, automate reporting , and support building safety and facility management.",Construction,R1 Rethink,,No,No,No,No,Yes,No
,World of Waste,https://www.worldofwaste.co/,WorldOfWaste.svg,Map displays countries with available texttile waste data.,Fashion & Textiles,R1 Rethink,,No,No,No,No,No,No
,Container Grid,https://containergrid.de/en/,ContainerGrid.png,"Everything you need to manage recycling and disposal processes, logistics and partnerships ContainerGrid offers solutions for waste management companies, recyclers and industrial customers who want to work seamlessly across locations.",Waste Management,R8 Recycle,,No,No,No,No,No,No
,GoodMine,https://www.goodmine.co.uk/,GoodMine.png,"Find the Next Life for Your Unwanted Stuff. Sell, Share, Repair, or Donate - All Your Options in One Place",,R3 Reuse,,Yes,No,No,No,No,No
,Spot Material,https://spotmaterial.com/,SpotMaterial.png,"Welcome to the online A—Z of materials for design, circularity and health. A platform filled with data, insight and inspiration to help with sustainable design.",,R1 Rethink,,No,No,No,No,No,No
,Valyuu,https://valyuu.com/,Valyuu.svg,Bring a circular world to life Valyuu designs and delivers customer centric tailor-made full service recommerce services. Embedded recommerce. Full service Recommerce,,R3 Reuse,,No,No,No,Yes,No,No
,Tradefox,https://get.tradefox.co/,Tradefox.svg,Preventing & recovering losses in the scrap industry.,,R3 Reuse,,Yes,No,No,Yes,No,No
,IRS Robotics,https://www.irsrobotics.com/en/,IRSRobotics.jpg,"Refurbished robots, Robot Spare Parts & Service",,R3 Reuse,,Yes,No,No,Yes,No,No
,Reliving,https://www.reliving.nl/,Reliving.svg,Marketplace for second-hand and vintage furniture. Shop for a unique interior or sell a piece of furniture that deserves a new life,,R3 Reuse,,Yes,No,No,Yes,No,No
,Byewaste,https://www.byewaste.nl/,Byewaste.svg,Give a second life to your pre-loved items. We collect items you no longer need directly from your home and give them a second life through our network of sustainable partners .,Fashion & Textiles,R3 Reuse,,Yes,No,No,Yes,No,No
,Whoppah,https://www.whoppah.com/,Whoppah.svg,Buy and sell on the marketplace for your dream interior,,R3 Reuse,,Yes,No,No,Yes,No,No
,Recommerce Group,https://www.recommerce-group.com/en/services/circular-services,RecommerceGroup.svg,"We guide you through the circular economy. We help you manage the second life of used equipment, from buyback to resale, by combining responsibility and profits. In 2021, Recommerce creates CircularX, a SaaS platform that allows all retailers to launch a trade-in, refurbishment, and resale offer in any product category.",Retail,R3 Reuse,,No,No,No,Yes,No,No
,MachineryZone,https://www.machineryzone.nl/,MachineryZone.jpg,"Present in over 20 countries, the Machinery website specializes in the sale and purchase of public works equipment, transport equipment and loading and unloading equipment, both new and second-hand.",,R3 Reuse,,Yes,No,No,Yes,No,No
,Reposit,https://reposit.world/,Reposit.png,"Reposit is delivering a platform to remove the barriers for all stakeholders to transition to reuse. We offer a sustainable and innovative approach to product packaging through packaging as a service, transforming it into a reusable and circular system. By leveraging high-quality, eco-friendly materials and a seamless return infrastructure, Reposit helps businesses reduce waste, lower carbon footprints, and deliver an enhanced consumer experience. It’s a solution designed for brands and retailers committed to sustainability, creating a smarter, greener future for packaging.",,R3 Reuse,,No,No,No,No,Yes,No
,Keylight,https://www.keylight.com/,Keylight.svg,"The only subscription business platform that combines omnichannel commerce, subscription management, billing and predictive analytics – with one user-centric backbone.",,R3 Reuse,,No,Yes,No,No,No,No
,Olik,https://olik.ai/,Olik.png,"Digitalizing Circularity Journey for Brands.  With Olik's Repairability, businesses gain complete control over their workshop operations. Our Rental solution empowers businesses to offer products on a temporary basis. Olik's Recommerce solution revolutionizes how businesses manage excess inventory",,R3 Reuse,,No,Yes,No,Yes,No,No